### ISSUE TITLE
Fix ARP resolution when interface has multiple IPv4 addresses

### ISSUE THREAD

**Issue by junekiwi** [maxmouchet/caracat#3]
Seems to be due to interfaces having multiple IPv4 addresses and picking the wrong one as source:
```
IPv4 address for eth0: 178.62.215.109
IPv4 address for eth0: 10.18.0.6
```

```
10:45:42.578332 ARP, Request who-has 178.62.192.1 tell 10.18.0.6, length 28
10:45:45.666079 ARP, Request who-has 178.62.192.1 tell 178.62.215.109, length 28
10:45:45.668462 ARP, Reply 178.62.192.1 is-at fe:00:00:00:01:01 (oui Unknown), length 46
```
